{
  "schemaVersion": "v3-media-workspace-comprehension/v1",
  "task": {
    "taskId": "media_task_11111111111111111111111111111111",
    "taskRevision": 9,
    "sourceIdentity": "portal:bilibili:BV1ZpYd66ELP:1:cid001",
    "mediaDurationMs": 792000,
    "outlineId": "outline_22222222222222222222222222222222"
  },
  "authorization": {
    "groundedTextCloudStatus": "disabled",
    "providerId": null,
    "modelId": null,
    "outboundDerivedTextSha256": null,
    "rawMediaUploadCount": 0,
    "selectedFrameUploadCount": 0
  },
  "evidenceCatalog": [
    { "evidenceId": "mtr_00000000000000000000000000000001", "kind": "transcript", "timestampStartMs": 0, "timestampEndMs": 95000, "contentSha256": "1111111111111111111111111111111111111111111111111111111111111111", "privateArtifactRef": "transcript/part-01.json" },
    { "evidenceId": "mev_00000000000000000000000000000002", "kind": "frame", "timestampStartMs": 62000, "timestampEndMs": 62000, "contentSha256": "2222222222222222222222222222222222222222222222222222222222222222", "privateArtifactRef": "frames/frame-000062000.webp" },
    { "evidenceId": "mtr_00000000000000000000000000000003", "kind": "transcript", "timestampStartMs": 96000, "timestampEndMs": 380000, "contentSha256": "3333333333333333333333333333333333333333333333333333333333333333", "privateArtifactRef": "transcript/part-02.json" },
    { "evidenceId": "mev_00000000000000000000000000000004", "kind": "ocr_block", "timestampStartMs": 245000, "timestampEndMs": 245000, "contentSha256": "4444444444444444444444444444444444444444444444444444444444444444", "privateArtifactRef": "ocr/frame-000245000.json" },
    { "evidenceId": "mev_00000000000000000000000000000005", "kind": "frame", "timestampStartMs": 322000, "timestampEndMs": 322000, "contentSha256": "5555555555555555555555555555555555555555555555555555555555555555", "privateArtifactRef": "frames/frame-000322000.webp" },
    { "evidenceId": "mtr_00000000000000000000000000000006", "kind": "transcript", "timestampStartMs": 381000, "timestampEndMs": 792000, "contentSha256": "6666666666666666666666666666666666666666666666666666666666666666", "privateArtifactRef": "transcript/part-03.json" },
    { "evidenceId": "mev_00000000000000000000000000000007", "kind": "vision_caption", "timestampStartMs": 610000, "timestampEndMs": 610000, "contentSha256": "7777777777777777777777777777777777777777777777777777777777777777", "privateArtifactRef": "vision/frame-000610000.json" },
    { "evidenceId": "mev_00000000000000000000000000000008", "kind": "frame", "timestampStartMs": 610000, "timestampEndMs": 610000, "contentSha256": "8888888888888888888888888888888888888888888888888888888888888888", "privateArtifactRef": "frames/frame-000610000.webp" }
  ],
  "outline": {
    "outlineId": "outline_22222222222222222222222222222222",
    "taskId": "media_task_11111111111111111111111111111111",
    "taskRevision": 9,
    "title": "真实视频的结构化理解示例",
    "summary": "以证据闭合的章节、时间节点、画面和问答组织视频内容。",
    "chapters": [
      { "chapterId": "chapter_0000000000000001", "parentChapterId": null, "depth": 1, "order": 0, "startMs": 0, "endMs": 95000, "title": "问题与背景", "thesis": "介绍问题背景和分析目标。", "keyPoints": ["说明上下文", "提出核心问题"], "evidenceIds": ["mtr_00000000000000000000000000000001", "mev_00000000000000000000000000000002"], "representativeFrameEvidenceId": "mev_00000000000000000000000000000002" },
      { "chapterId": "chapter_0000000000000002", "parentChapterId": null, "depth": 1, "order": 1, "startMs": 96000, "endMs": 380000, "title": "方法与演示", "thesis": "通过演示解释主要方法。", "keyPoints": ["拆分步骤", "观察界面证据"], "evidenceIds": ["mtr_00000000000000000000000000000003", "mev_00000000000000000000000000000004", "mev_00000000000000000000000000000005"], "representativeFrameEvidenceId": "mev_00000000000000000000000000000005" },
      { "chapterId": "chapter_0000000000000003", "parentChapterId": null, "depth": 1, "order": 2, "startMs": 381000, "endMs": 792000, "title": "结论与限制", "thesis": "总结结果并说明证据边界。", "keyPoints": ["归纳结论", "保留证据不足状态"], "evidenceIds": ["mtr_00000000000000000000000000000006", "mev_00000000000000000000000000000007", "mev_00000000000000000000000000000008"], "representativeFrameEvidenceId": "mev_00000000000000000000000000000008" }
    ],
    "contentSha256": "9999999999999999999999999999999999999999999999999999999999999999"
  },
  "timeline": {
    "projectionId": "timeline_aaaaaaaaaaaaaaaaaaaaaaaaaaaaaaaa",
    "outlineId": "outline_22222222222222222222222222222222",
    "chapterIds": ["chapter_0000000000000001", "chapter_0000000000000002", "chapter_0000000000000003"],
    "moments": [
      { "momentId": "moment_0000000000000001", "chapterId": "chapter_0000000000000001", "timestampMs": 0, "kind": "chapter", "title": "背景开始", "evidenceIds": ["mtr_00000000000000000000000000000001"], "frameEvidenceId": null },
      { "momentId": "moment_0000000000000002", "chapterId": "chapter_0000000000000001", "timestampMs": 62000, "kind": "frame", "title": "背景画面", "evidenceIds": ["mev_00000000000000000000000000000002"], "frameEvidenceId": "mev_00000000000000000000000000000002" },
      { "momentId": "moment_0000000000000003", "chapterId": "chapter_0000000000000002", "timestampMs": 96000, "kind": "chapter", "title": "方法开始", "evidenceIds": ["mtr_00000000000000000000000000000003"], "frameEvidenceId": null },
      { "momentId": "moment_0000000000000004", "chapterId": "chapter_0000000000000002", "timestampMs": 245000, "kind": "key_point", "title": "关键步骤", "evidenceIds": ["mev_00000000000000000000000000000004"], "frameEvidenceId": null },
      { "momentId": "moment_0000000000000005", "chapterId": "chapter_0000000000000002", "timestampMs": 322000, "kind": "frame", "title": "演示画面", "evidenceIds": ["mev_00000000000000000000000000000005"], "frameEvidenceId": "mev_00000000000000000000000000000005" },
      { "momentId": "moment_0000000000000006", "chapterId": "chapter_0000000000000003", "timestampMs": 381000, "kind": "chapter", "title": "结论开始", "evidenceIds": ["mtr_00000000000000000000000000000006"], "frameEvidenceId": null },
      { "momentId": "moment_0000000000000007", "chapterId": "chapter_0000000000000003", "timestampMs": 610000, "kind": "frame", "title": "结论画面", "evidenceIds": ["mev_00000000000000000000000000000007", "mev_00000000000000000000000000000008"], "frameEvidenceId": "mev_00000000000000000000000000000008" },
      { "momentId": "moment_0000000000000008", "chapterId": "chapter_0000000000000003", "timestampMs": 760000, "kind": "quote", "title": "最终限制", "evidenceIds": ["mtr_00000000000000000000000000000006"], "frameEvidenceId": null }
    ],
    "contentSha256": "aaaaaaaaaaaaaaaaaaaaaaaaaaaaaaaaaaaaaaaaaaaaaaaaaaaaaaaaaaaaaaaa"
  },
  "mindmap": {
    "projectionId": "mindmap_bbbbbbbbbbbbbbbbbbbbbbbbbbbbbbbb",
    "outlineId": "outline_22222222222222222222222222222222",
    "nodes": [
      { "nodeId": "node_0000000000000001", "parentNodeId": null, "depth": 0, "kind": "root", "label": "视频主题", "chapterId": null, "timestampMs": null, "evidenceIds": [] },
      { "nodeId": "node_0000000000000002", "parentNodeId": "node_0000000000000001", "depth": 1, "kind": "chapter", "label": "问题与背景", "chapterId": "chapter_0000000000000001", "timestampMs": 0, "evidenceIds": ["mtr_00000000000000000000000000000001"] },
      { "nodeId": "node_0000000000000003", "parentNodeId": "node_0000000000000002", "depth": 2, "kind": "key_point", "label": "提出核心问题", "chapterId": "chapter_0000000000000001", "timestampMs": 62000, "evidenceIds": ["mev_00000000000000000000000000000002"] },
      { "nodeId": "node_0000000000000004", "parentNodeId": "node_0000000000000001", "depth": 1, "kind": "chapter", "label": "方法与演示", "chapterId": "chapter_0000000000000002", "timestampMs": 96000, "evidenceIds": ["mtr_00000000000000000000000000000003"] },
      { "nodeId": "node_0000000000000005", "parentNodeId": "node_0000000000000004", "depth": 2, "kind": "key_point", "label": "观察界面证据", "chapterId": "chapter_0000000000000002", "timestampMs": 245000, "evidenceIds": ["mev_00000000000000000000000000000004"] },
      { "nodeId": "node_0000000000000006", "parentNodeId": "node_0000000000000001", "depth": 1, "kind": "chapter", "label": "结论与限制", "chapterId": "chapter_0000000000000003", "timestampMs": 381000, "evidenceIds": ["mtr_00000000000000000000000000000006"] },
      { "nodeId": "node_0000000000000007", "parentNodeId": "node_0000000000000006", "depth": 2, "kind": "key_point", "label": "保留证据边界", "chapterId": "chapter_0000000000000003", "timestampMs": 610000, "evidenceIds": ["mev_00000000000000000000000000000007"] }
    ],
    "contentSha256": "bbbbbbbbbbbbbbbbbbbbbbbbbbbbbbbbbbbbbbbbbbbbbbbbbbbbbbbbbbbbbbbb"
  },
  "askBenchmark": [
    { "questionId": "question_00000001", "category": "factual", "question": "背景是什么？", "status": "answered", "answerBlocks": [{ "text": "视频先说明背景。", "evidenceIds": ["mtr_00000000000000000000000000000001"], "timestampMs": 10000 }], "retrievalPlanSha256": "cccccccccccccccccccccccccccccccccccccccccccccccccccccccccccccccc", "executionMode": "local_deterministic", "criticalMeaningError": false, "citationSupported": true },
    { "questionId": "question_00000002", "category": "factual", "question": "核心问题是什么？", "status": "answered", "answerBlocks": [{ "text": "核心问题在第一章提出。", "evidenceIds": ["mtr_00000000000000000000000000000001"], "timestampMs": 62000 }], "retrievalPlanSha256": "cccccccccccccccccccccccccccccccccccccccccccccccccccccccccccccccc", "executionMode": "local_deterministic", "criticalMeaningError": false, "citationSupported": true },
    { "questionId": "question_00000003", "category": "factual", "question": "方法如何展开？", "status": "answered", "answerBlocks": [{ "text": "方法按步骤演示。", "evidenceIds": ["mtr_00000000000000000000000000000003"], "timestampMs": 120000 }], "retrievalPlanSha256": "cccccccccccccccccccccccccccccccccccccccccccccccccccccccccccccccc", "executionMode": "local_deterministic", "criticalMeaningError": false, "citationSupported": true },